{
  "schema": "dpl.slide/3",
  "id": "01M5FYCBY9YQ0AT4XXWR7ST40V",
  "rev": 1,
  "component": "stat@1",
  "background": {
    "kind": "mood-blend",
    "moods": [
      "glacier-signal",
      "violet-static"
    ],
    "motion": "blend-drift"
  },
  "blocks": [
    {
      "kind": "text",
      "id": "eyebrow",
      "text": "Tokens per second, one H100",
      "font": "rajdhani",
      "size": "h4",
      "ink": "muted"
    },
    {
      "kind": "text",
      "id": "value",
      "text": "18,400",
      "font": "orbitron",
      "size": "display-xl",
      "ink": "strong"
    },
    {
      "kind": "text",
      "id": "label",
      "text": "and your question uses about forty of them",
      "font": "spacegrotesk",
      "size": "body-lg",
      "ink": "subtle"
    }
  ],
  "provenance": {
    "upgraded_from": "v1"
  }
}
