{
  "schema": "dpl.slide/3",
  "id": "01M5FYCBYFPG03H3BBD2D02MD5",
  "rev": 1,
  "component": "title@1",
  "background": {
    "kind": "mood-blend",
    "moods": [
      "ember-drift",
      "deep-lagoon"
    ],
    "motion": "blend-drift",
    "ambience": "pulse"
  },
  "blocks": [
    {
      "kind": "text",
      "id": "eyebrow",
      "text": "Echoes of Sentience",
      "font": "sharetechmono",
      "size": "eyebrow",
      "ink": "tone"
    },
    {
      "kind": "text",
      "id": "title",
      "text": "The stack, laid bare",
      "font": "orbitron",
      "size": "display",
      "ink": "strong"
    },
    {
      "kind": "text",
      "id": "subtitle",
      "text": "What actually runs when you ask a model a question — and what it costs.",
      "font": "spacegrotesk",
      "size": "h3",
      "ink": "muted"
    }
  ],
  "enter": "rise",
  "provenance": {
    "upgraded_from": "v1"
  }
}
